"Tropical Storm Nicole, barreling toward the northwestern Bahamas early Wednesday morning, was expected to reach hurricane strength before approaching Florida’s east coast later in the day or early on Thursday, forecasters said. https://t.co/MabOCKDjWf"
"Brad Raffensperger, the Republican secretary of state in Georgia who resisted Donald Trump's efforts to overturn the state's election results in 2020, won re-election.  https://t.co/VZxrRTcVp6"
"Lt. Gov. John Fetterman, Democrat of Pennsylvania, celebrated his victory over Mehmet Oz, the Trump-endorsed, Republican celebrity doctor. Fetterman flipped a Senate seat that had been in Republican hands. https://t.co/FBlJRVl4az https://t.co/IhWE4RrdQj"
"RT @maggieNYT: With @MichaelCBender, Trump still has a hold on Republicans, but the midterm results were a red flag on Trump’s appeal natio…"
"Stacey Abrams, a Democrat, congratulated her Republican opponent, Gov. Brian Kemp, on his re-election and said she would never “stop running for a better Georgia.” https://t.co/MpiKABpaLI https://t.co/ACjDXOvwfa"
"Nearly 200 Republicans who have questioned the results of the 2020 election, or denied President Biden’s victory outright, have won races so far in the midterms. https://t.co/4NXJRXSzhO"
"Lt. Gov. John Fetterman defeated Mehmet Oz to capture Pennsylvania’s Senate race, flipping a seat that had been in Republican hands. https://t.co/MNgOpVa9gS"
"Hillary Scholten, a Democrat, flipped a House seat in Michigan, defeating a hard-right Republican and giving Democrats a crucial pickup as they struggled to hold on to their majority. https://t.co/ZGLLtLAxBp"
"Gov. Tony Evers of Wisconsin, a Democrat, has won re-election, defeating Republican Tim Michels. https://t.co/ENAhobGi7S"
"Becca Balint, a progressive leader in the Vermont Legislature, won the state’s lone U.S. House seat, defeating the Republican Liam Madden. Balint will be the first woman elected to Congress from the state. https://t.co/9yt75S71A8 https://t.co/nc4A1qUeDg"
"Rep. Chris Pappas, Democrat of New Hampshire, defeated his Republican challenger, Karoline Leavitt, prevailing over a stiff challenge in what had been considered one of the top pickup opportunities for Republicans this cycle. https://t.co/GeA5sacqQh"
Here's what needs to happen for either party to win control of the U.S. Senate after Democrats flipped a seat in Pennsylvania. https://t.co/WqcxiJDgQK https://t.co/0ZPH3TwSbN
"Voters in Maryland and Missouri approved legalizing recreational marijuana, while Arkansas and North Dakota voters rejected similar ballot measures. https://t.co/4hjwgxsdJh"
"Gov. Kathy Hochul of New York defeated Rep. Lee Zeldin and became the first woman ever elected to the state’s highest office. “The lesson of tonight’s victory is that given the choice, New Yorkers refuse to go backward on our long march toward progress.” https://t.co/LucF0gN5xl https://t.co/yeZDoqczUP"
"With John Fetterman's win in Pennsylvania, a crucial victory for Democrats, here is where the race for Senate control stands now. Follow live results: https://t.co/hejJ5oUVxx https://t.co/96Ic1ou540"
"Breaking News: John Fetterman won Pennsylvania’s Senate race, flipping the seat for Democrats. He beat Mehmet Oz, the Trump-endorsed celebrity doctor, after surviving a near-fatal stroke in May. https://t.co/Nll2oI6xGA https://t.co/4CDWhjMbrY"
"Breaking News: John Fetterman has won a U.S. Senate seat in Pennsylvania, defeating Republican Dr. Mehmet Oz and flipping the seat for Democrats. https://t.co/jA8MVIYJUf"
"Gov. Gretchen Whitmer of Michigan, a Democrat, has won re-election, defeating Republican Tudor Dixon. https://t.co/Bvc7ScMcLE"
"Representative Matt Gaetz, a Republican, has won re-election in the First District in Florida. https://t.co/aQ5W2zKrF6"
"Gov. Janet Mills of Maine, a Democrat, won re-election against former Gov. Paul LePage, a Republican who was seeking a third, nonconsecutive term. https://t.co/WQhKRmvTZQ"
"Representative Vicente Gonzalez, a Democrat, has won the 34th District in Texas. He defeated Mayra Flores, a Republican who flipped the seat for her party in a June special election. https://t.co/oON3b1kbDT"
"Kathy Hochul, a Democrat, has won the governor’s race in New York, defeating Republican Lee Zeldin to become the first woman elected to the state’s highest office. https://t.co/4QgtAc1NGN"
"The mayoral race in Los Angeles between Representative Karen Bass and Rick Caruso, the billionaire real estate developer, is too close to call. Officials say the count could take days or weeks because so much voting in California is by mail. https://t.co/WjIzvGKZlW"
"As more counties in Pennsylvania finish counting votes, things keep looking better for John Fetterman's Senate bid. He's outperforming Biden's 2020 results across the state and is up 8 points in counties that were the closest in 2020. Follow live: https://t.co/aHO8Ve678x https://t.co/8Jb4nERkcD"
"Rep. Dan Newhouse, Republican of Washington, was re-elected to a fifth term, defeating his Democratic challenger after holding off a half-dozen Republicans who had targeted him for his vote to impeach Donald Trump. https://t.co/VeaKjP2JIy"
"Don Davis, a Democratic state senator and Air Force veteran, won an open House seat in North Carolina. He defeated Sandy Smith, a Republican who called for ""executions"" after the 2020 election and had proudly said she marched to the Capitol on Jan. 6. https://t.co/bxA99aGbSc"
"Ken Paxton, the Republican attorney general of Texas, won re-election to a third term despite a lingering criminal indictment and accusations of corruption by former top aides. https://t.co/OQdLJZLe1F"
Follow live as results come in from Representative Lauren Boebert's race against Adam Frisch for Colorado's third congressional district. https://t.co/O14yVKg9At
"Josh Shapiro, a Democrat, has won the governor's race in Pennsylvania. He defeated Doug Mastriano, a far-right Republican state senator who was a central figure in trying to overturn the state’s 2020 presidential election results. https://t.co/P3mD55W5mI"
"Follow live as results roll in from the critical Senate race in Pennsylvania between John Fetterman and Mehmet Oz.
https://t.co/kFzq87TZ6O"
"Gov. Greg Abbott of Texas, a Republican, fended off a challenge from Beto O’Rourke, his Democratic opponent, winning a third term and dashing Democrats’ hopes of retaking the governor’s mansion for the first time in decades.  https://t.co/pVjJXbULGj https://t.co/YMfeiJ4sSl"
"Stacey Abrams has conceded to Brian Kemp, the Republican governor of Georgia, his campaign said on Tuesday. https://t.co/wSadYgdBgz https://t.co/5PMACV2ua2"
Follow the needle for live New York Times estimates of the race for control of Congress. https://t.co/ZPZLfbn2eG
"Representative Ted Budd, a Republican, has won a U.S. Senate seat in North Carolina. He defeated Cheri Beasley, a Democrat who would have become the state's first Black senator if elected. https://t.co/4BpJKUNHS0"
"As of 11:54 p.m. Eastern, here is where Senate results stand. Follow live:  https://t.co/FeyDXxc499 https://t.co/hhdbK4AA80"
Senator Maggie Hassan's win in New Hampshire means Democrats have held onto one of their most vulnerable seats in the battle for Senate control. Here's where the race stands now: https://t.co/ur1wW67T4j https://t.co/zb27IzVHpH
"Maggie Hassan, a Democrat, has been re-elected to a U.S. Senate seat in New Hampshire. https://t.co/z42rJ3B3er"
Here's where the race for control of the U.S. Senate stands right now. Follow the latest results: https://t.co/HZDiiKH23f https://t.co/kKWBYLgbm8
Here's where the race for control of the U.S. Senate stands right now. Follow the latest results: https://t.co/HZDiiKH23f https://t.co/iXhCP7mXH2
"Chuck Grassley, the 89-year-old Republican senator from Iowa, won his eighth term. It means he could remain on Capitol Hill until he is 95. https://t.co/aE77PeXjaL"
"Representative Andy Kim, a New Jersey Democrat whose race appeared to narrow in the final weeks of the campaign, was re-elected on Tuesday to a third term over Republican challenger Bob Healey Jr. https://t.co/CjjqnK9ntE"
"J.D. Vance, a Republican, has won a U.S. Senate seat in Ohio. https://t.co/sO7YpmH5C2"
"Stacey Abrams has conceded to Brian Kemp, the Republican governor of Georgia, ending a bitter, high-profile rematch of their 2018 contest. The Associated Press has not yet called the race. https://t.co/zlhLwsWNYC"
"Gov. Greg Abbott of Texas, a Republican, has won re-election. He defeated Beto O'Rourke, who was trying to become the first Democrat to lead the state in more than 25 years. https://t.co/HXasCQujQt"
"Vermont was the only state in the country that had never elected a woman to Congress. Becca Balint, a Democrat, has now changed that.

Follow other results here. https://t.co/SfKIOlCpsi https://t.co/0FUqEFHxzZ"
"Gov. Ron DeSantis, Republican of Florida, won re-election in a victory so astounding that he flipped Miami-Dade County, which hadn't voted for a GOP candidate for governor in two decades. ""We have rewritten the political map,"" he said in his victory speech.https://t.co/OekuVtivwe https://t.co/M8jDa0vfdV"
"Abigail Spanberger, a Democrat, has won re-election in Virginia's Seventh District. https://t.co/yUjlEoZaPw"
"Senator Michael Bennet, Democrat of Colorado, was elected to a third full term on Tuesday, holding off a surprisingly strong challenge from Joe O’Dea, a Republican political newcomer.
https://t.co/ulINuxsLiI"
"Senator Michael Bennet of Colorado, a Democrat, has won re-election. https://t.co/aomt2fzrhd"
"An Arizona judge denied an emergency request from Republicans to extend voting by three hours in Maricopa County, after vote-counting machines malfunctioned at dozens of election centers.
https://t.co/phR4LZ2UH3"
The possession and use of cannabis in Maryland will be legal for people 21 and older starting in July 2023. See how similar measures are faring in other states on Tuesday: https://t.co/BH39FAKgVU https://t.co/VDEw6FYLEd
"Alexandria Ocasio-Cortez, a Democrat, has won re-election in the 14th District in New York. https://t.co/wm7zXUHPiN https://t.co/tz6ZKAdyzU"
"Nicole Malliotakis, the only Republican representing part of New York City in Congress, has won re-election. https://t.co/zDmx7eqxVs"
"Rep. Marjorie Taylor Greene, whose racist and antisemitic conspiracy theories put her on the fringes of the Republican Party when she was first elected two years ago, was re-elected on Tuesday and is poised to play a more central role in the next Congress. https://t.co/nNU72Jbqxu https://t.co/fHAE3Kyo6f"
Correction: An earlier version of this tweet and story incorrectly said that Wes Moore is the nation's third Black governor. He is the third Black person elected governor of a U.S. state since Reconstruction. We deleted the incorrect tweet.
"As the polls were about to close in Arizona at 9 p.m. Eastern time, a Superior Court judge in Maricopa County denied a RNC lawsuit that sought to extend voting by three hours, until 10 p.m. local time. The county opposed the extension. https://t.co/4xyoTA0Wn8"
"Katie Britt, a Republican, won the election for a U.S. Senate seat in Alabama. https://t.co/pwJgicm6Ep"
"Polls have begun closing in 10 more states, including in Arizona and Wisconsin, where some of the most closely-watched races are taking place. Follow live results: https://t.co/kSn6ETJp56 https://t.co/Uqg0q3v45Z"
"Senator Chuck Schumer of New York, a Democrat, has won re-election. He is now set to become the state's longest serving senator to date. https://t.co/Xlqq4Tz8HM"
"Markwayne Mullin, a Republican, has been elected to fill the Senate seat in Oklahoma left by Jim Inhofe, a retiring Republican.  https://t.co/JTFLigsjQr https://t.co/DXIAWducgs"
"Rep. Marjorie Taylor Greene, whose racist and antisemitic conspiracy theories put her on the fringes of the Republican Party when she was first elected two years ago, was re-elected on Tuesday and is poised to play a more central role in the next Congress.
https://t.co/YIm3uJQaja"
"Gov. J.B. Pritzker of Illinois, a Democrat, has been re-elected. https://t.co/cTTNUFgrhL"
"Here’s where the battle for control of the U.S. Senate stands now, based on the races called so far.

Follow live results here. https://t.co/MlvIV5gyr4 https://t.co/mjfE7p4bO2"
"Sarah Huckabee Sanders, a Republican, has won the governor's race in Arkansas.

She is a former White House press secretary in the Trump administration and the daughter of a former Arkansas governor, Mike Huckabee. https://t.co/lXH9F5OT7L"
"Here’s where the battle for control of the U.S. House stands now, based on the races called so far.

Follow live results here. https://t.co/YqSN3g75Mr https://t.co/iuGSNLvXRJ"
"Wes Moore, a Democrat, was a newcomer to politics who this summer emerged from a crowded primary packed with political veterans. https://t.co/LdYGIZaHjw https://t.co/A4VoyO0XYd"
"Gen Z officially has a seat in Congress. 

Maxwell Alejandro Frost, a 25-year-old Democrat, won his election on Tuesday in Florida’s 10th Congressional District over Calvin Wimbish, a Republican.
https://t.co/HeoduCmjMO https://t.co/X4WzH2XdY7"
"Maura Healey, the newly elected Democratic governor of Massachusetts, is also the first openly lesbian woman to be elected governor in the U.S. https://t.co/BLfWma02F1 https://t.co/lAunnzQwiC"
"Senator Marco Rubio of Florida, a Republican, has won re-election, defeating Democrat Val Demings. https://t.co/itevmuJ0RV"
"Gen Z officially has a seat in Congress. 

Maxwell Alejandro Frost, a 25-year-old Democrat, won his election on Tuesday in Florida’s 10th Congressional District over Calvin Wimbish, a Republican.
https://t.co/STv0XfJUWC"
The needle projects the final result based on an analysis of the vote that’s been counted and an estimate of how many votes are still left to be counted. Here's more on how it works: https://t.co/Hmy7SswBa0
"Our election forecast shows Republicans favored to win control of the House but a dead heat for the Senate, as of 8:13 p.m. Eastern. Follow the needle live:
https://t.co/pTB0fMiX0A"
"The RNC and several Republican candidates in Arizona have filed an emergency lawsuit seeking to extend voting hours in the state’s most populous county, Maricopa, after problems with vote tabulation equipment earlier on Tuesday. https://t.co/RqYzBJmSpf"
"Gov. Ron DeSantis of Florida, a Republican, has been reelected. https://t.co/4jA1s9I6Jz"
"Senator Rand Paul of Kentucky, a Republican, has been reelected. https://t.co/Vf1pF5OPHk"
"RT @jazmineulloa: In Wickenberg, a deep red outpost of some 7,000 people northwest of Phoenix, concerns over Tuesday’s election vote count…"
"Para buena parte del mundo, las elecciones de mitad de mandato en EE. UU. son otra señal de lo que algunos ven como una tendencia problemática. Muchas de las democracias que solían ver al país como un modelo están preocupadas de que haya perdido el rumbo.
https://t.co/bvOAKKuYp3"
Voters in five states where slavery or involuntary servitude remains legal as a punishment for people who are convicted of crimes will decide on Tuesday whether to ban the practices outright. See our article from October. https://t.co/qi4z5VldBp
"Nearly half of all U.S. states allow you to register and cast ballots on Election Day — here's the full list. (And if you're in line when your polling place closes, you can still vote.) https://t.co/zSJc0bjih8 https://t.co/bRDGU06OFZ"
"Peter Welch, a Democrat, has won the race in Vermont to replace Senator Pat Leahy, who is retiring at the end of this year. https://t.co/oGbxGDcH2c"
"Senator Tim Scott of South Carolina, a Republican, has been elected to another term. https://t.co/IWUAnbMdFZ"
"The first polls have closed in several states, including Florida and Georgia, where some of the most closely-watched races are taking place. Follow live results: https://t.co/RHq8i7PmLz https://t.co/86tirf03zL"
"In Opinion

Join our columnists right now as they discuss the midterm races, results and the future of America. https://t.co/mWb8vlJxWk"
"You should expect that official results for many midterm races will not be announced on the night of the election, and could in fact take days to be tallied. It's not a sign of election irregularities. Catch up on other unfounded claims spreading online: https://t.co/sPemK3nKdh https://t.co/HrOs4Y2Qmj"
"Philadelphia says it may take a few days to report all votes. An official in Allegheny County, which includes Pittsburgh, said it processed the 155,000 mail-in ballots received so far and will report those results soon after polls close at 8 p.m. Eastern. https://t.co/hbwWh6SJly"
"A woman and her son were removed as election workers in Georgia after officials said they discovered social media posts linking her to the Jan. 6 riot and implying she was going to record elements of her work at the polling place, which is forbidden. https://t.co/2pYm5lFsUQ"
The first polls have now closed in Indiana and Kentucky. Follow live updates from our reporters: https://t.co/WukPlUInwN https://t.co/yB9uQFPiYl
"Donald Trump said that he would support Representative Kevin McCarthy, the GOP minority leader, in his bid for speaker if Republicans win back control of the House in the midterms on Tuesday. https://t.co/kubGIdndpa"
"Voters in New York City said abortion rights and crime were central to their choices in the state’s governor's race, where Gov. Kathy Hochul, a Democrat, is facing Rep. Lee Zeldin, a Republican from Long Island. https://t.co/1mHiEFmk5N https://t.co/RC1yZPJR1O"
Here’s what polling places look like around the U.S. https://t.co/vS1NDQgtOq https://t.co/FR89Rn2bAL
"Before polls opened on Tuesday, Donald Trump warned Gov. Ron DeSantis against mounting a challenge to Trump’s anticipated 2024 presidential candidacy: ""I know more about him than anybody other than perhaps his wife, who is really running his campaign."" https://t.co/pIIGYwmNMo"
"Voter fraud is exceedingly rare in the U.S., but that didn't stop the Republican-controlled Florida Legislature and Gov. Ron DeSantis from establishing a state agency dedicated to ""election crimes and security"" with a $1.1 million budget. https://t.co/D9SQkTPaqQ"
Elections and anxiety often go hand in hand. Here are some evidence-based strategies that can help you cope. https://t.co/Bu9Bq5AVqh https://t.co/WkF7ClDpyA
President Volodymyr Zelensky of Ukraine on Tuesday warned that the “insane” and “illegal” war provoked by Russia was distracting international attention from the threat of climate change and contributing to the “catastrophic” effects of global warming. https://t.co/ByPWdrXBjK
"Voter registration records in the U.S. are public, and can be shared, bought and sold. Candidates, party committees and nonprofits often use intimate details to target voters with political text messages, and the scale of profiling is often invisible. https://t.co/WRGXYO3DSO"
The Golden State Warriors wore warm-ups on Monday encouraging people to vote as part of a leaguewide campaign to increase awareness among fans about voting access. No games were scheduled on Tuesday in an effort to drive voter participation. https://t.co/Wiqc18n5MN https://t.co/PNYSGuuHbR
"The status on abortion is clear in most states, and the midterms are unlikely to affect the status quo. But in at least seven states, highly competitive races could tip the balance in support of either access to abortion or further restrictions. https://t.co/1kMAFQWyST"
"From @TheAthleticFC:

The 2022 World Cup kicks in less than two weeks, with hosts Qatar playing Ecuador on Sunday, Nov. 20. Managers must name their squads before the tournament begins and time is running out to do so.  
https://t.co/ab8UKdrS7v"
"The polls will close over a seven-hour period on Tuesday. Here's a mapped guide to when the first polls close in each state, and what midterm races to watch at each point. https://t.co/PZA5K3wFS3"
"Republicans entered the final days of the 2022 campaign as clear favorites to take control of the House. If that happens, the next question will be whether the presumed speaker, Rep. Kevin McCarthy, will have a comfortable majority or a narrow one. https://t.co/EWD3oIRwxU"
"“She must make sure that everyone around her knows she is stable, and not talk about her feelings,” Imelda Staunton said of playing Queen Elizabeth II in the final two seasons of ""The Crown,"" adding, “But that doesn’t mean she doesn’t have feelings.” https://t.co/eP3344fo0P"
"In an election with a sharply divided electorate, the “I Voted” stickers are a reminder of the lighter side of civic engagement and a visual equalizer — including this one from Ulster County, New York. https://t.co/ZEgVb5GIY6 https://t.co/DhwZNLzoaW"
"Meaty mushrooms simmered with pearl onions, wine and carrots make for a rich Bourguignon-style stew. This recipe, a Melissa Clark classic, has more than 9,000 ratings and counting. https://t.co/sHL9oVz5j0 https://t.co/JqpMzoaKsg"
"RT @neelambohratx: New laws have left many disabled voters with burdensome options: 

• Face the risk of a mail-in ballot being rejected 
•…"
"Drake and 21 Savage’s collaborative album, “Her Loss,” is frisky and centerless, our critic writes. A mood more than a mode.
https://t.co/NYXk9aHk0y"
"This pumpkin-packed crumb cake is everything that is wonderful about fall baking.
https://t.co/yNETXG6W89 https://t.co/hS3rUYsFAr"
"A victim of Jeffrey Epstein, who for years maintained that the law professor Alan Dershowitz sexually assaulted her when she was a teenager, says she is no longer certain and may have made a mistake in accusing him. https://t.co/MZ9aNjlb7G"
"From @TheAthletic:

As baseball's offseason gets underway, here’s how each team views its key roster holes.
https://t.co/IRWhiumsPS"
"From @TheAthletic:

Despite a bevy of byes, the weekend provided some of the best action of the NFL season, with eight of the 11 games played Sunday decided by one score. So who's still standing? We ranked every team from best to worst.
https://t.co/yftrl6xXCT https://t.co/s3GD2EofkI"
"This Election Day, retirees, grandparents and other poll workers who hand out ballots and “I Voted” stickers are on the front lines of a battle over election fraud and democracy. https://t.co/Fw3F5n3nrw https://t.co/bzAY7obmRa"
"The effects of climate change are already “far-reaching and worsening” throughout the U.S., posing profound risks to virtually every aspect of society, according to a draft scientific report being circulated by the federal government. https://t.co/SzZQ6EXubJ"
"At polling sites across the U.S., voters on Tuesday reacted to the news of Donald Trump's “very big announcement” — almost certainly of a third White House run — with a polarized mix of apprehension, disdain, relief and elation. https://t.co/GCNwyHq6GK"
"Misinformation experts will continue monitoring misleading narratives about the election well after Tuesday. They've urged voters to be wary of images about individual incidents at the polls, warning that they could be exaggerated or taken out of context. https://t.co/4p31OAAbtM"
"RT @nytimesevents: In activist @Ayishas12’s home region of Pakistan, “tornadoes” of disease-carrying mosquitos are emerging from standing w…"
"The U.S. midterm elections will determine the balance of power in Congress, state legislatures and governorships. Follow along as our reporters provide updates from across the country. https://t.co/sEqt319syy https://t.co/JDrHXfJ25H"
"In a show of mistrust for the way Russian officials have been handling the doping case of Kamila Valieva, a figure skating star from the Beijing Games, the World Anti-Doping Agency has filed an appeal directly to the highest court in sports. https://t.co/njOuz8sJzq"
"Voters in New Hampshire and Mississippi face the highest personal cost in the country in terms of the time and effort required to cast a ballot, according to a study. Voters in Oregon and Washington have it the easiest. https://t.co/CQ1n14Bbwp"
This is the first election in which a substantial number of candidates for major offices are election deniers or conspiracy theorists. Whether and how defeated candidates and their supporters will accept their losses is a major unknown. https://t.co/1fLr9Mw0m1
"Americans will weigh in on abortion directly through ballot initiatives in five states: Michigan, Kentucky, California, Vermont and Montana. Here are highlights of our coverage of the issue. https://t.co/ribdWWCIqp"
"“None of this indicates any fraud,” an Arizona elections official said after reports of dozens of malfunctioning ballot-counting machines in Maricopa County on Tuesday. “This is a technical issue.” Voter fraud claims surged in right-wing media nonetheless. https://t.co/u4lmmSiYP6"
"For the first time since 2004, Wolf Blitzer will not be CNN's lead anchor announcing the network's general election projections during its on-air coverage.

That responsibility now belongs to Jake Tapper. https://t.co/OnU9wemMgd"
"Evelyn de Rothschild, a banking dynasty scion who had vast influence in British financial and political affairs, died at 91. https://t.co/GbXLrix1V5"
"Jaguars are back from the brink in Mexico’s Yucatán Peninsula thanks to local conservation efforts.
Our writer ventured into the tropical forest where the animals are newly thriving, to meet some of the people who helped save the elusive cats. https://t.co/86dcEFSTND"
Speaker Nancy Pelosi would not say how the assault on her husband had affected her thinking about whether to stay in Congress. But she said it underscored how Republicans are determined to “put a stop to me.” https://t.co/xlnIXAg9ce
