"Jeff Bezos, the founder of Amazon who is estimated to be worth $124 billion, said that he would give away most of his money to charity, making him the latest billionaire to pledge to donate his vast fortune during his lifetime.
https://t.co/hqDG3WCbv6"
"Breaking News: The director of the CIA met with his Russian counterpart to warn against the use of nuclear weapons in Ukraine, a White House spokesman said.
https://t.co/oqCA1CswO1"
"RT @tariqpanja: 🚨 ⚽️ 🍺 
World Cup officials scrambled over the weekend to follow a new edict from Qatari high command: Hide the beer.

— Bu…"
"“This war took the best heroes of our country,” President Volodymyr Zelensky of Ukraine said during an unannounced visit to the newly liberated city of Kherson. “That’s why we are going forward.”
https://t.co/ZxARX7HqcP https://t.co/qWc9nJN9Sq"
"As president, Donald Trump repeatedly said he wanted the IRS to investigate his political foes, a former chief of staff told The New York Times. https://t.co/pWsLYyYUxR"
"New York’s $15 minimum wage once made it a trailblazer. But as inflation has surged, other U.S. cities have vaulted past it. https://t.co/8ZpTqmve4r"
"On the first nationwide test of students in the U.S. since the pandemic, scores plummeted to levels not seen in 20 years.

What do the scores tell us, and what can schools do to help students recover? Listen to today’s episode of The Daily.
https://t.co/Kd8Ye9qKct"
"A student gunman was at large after he fatally shot three people and wounded two others at a garage on the University of Virginia campus Sunday night, the authorities said. People on the Charlottesville campus were told to shelter in place.

Live updates: https://t.co/BwsBsCaR1l"
"Russia’s foreign minister, Sergei Lavrov, denied that he had been hospitalized following reports that he had experienced a health problem ahead of the high-profile G20 summit of leaders in Indonesia. https://t.co/BQSAwhEUFr"
"RT @arappeport: Ahead of Biden-Xi meeting, Yellen encourages vaccinations in China as Covid restrictions slow growth https://t.co/bN3iahw7R3"
"Breaking News: President Biden and his Chinese counterpart, Xi Jinping, signaled an openness to repairing bilateral ties in their first summit as top leaders. https://t.co/M8LQMXOqRA https://t.co/HezecXFNJC"
"While control of the Senate has been settled, the House is still up for grabs. As of Monday morning, there are 19 uncalled races.

Here’s a look at some of the most competitive districts.
https://t.co/nKOcSIjty7"
"President Volodymyr Zelensky of Ukraine made an unannounced visit to the newly freed city of Kherson.

“We are, step by step, coming to all of our country,” he said. “I am happy we are in Kherson.”
https://t.co/GoG6Y7lW4O https://t.co/2Hhpygf4O1"
"Treasury Secretary Janet Yellen said she hopes China is able to roll out a more effective Covid vaccination campaign.

So far, China has largely contained its spread with strict lockdowns and travel restrictions that have slowed the economy. https://t.co/z2JJC5ud4H"
"Recriminations have erupted among leading Republicans after the party failed to gain control of the Senate in the midterms. Republican ire is centered on Donald Trump, whose handpicked candidates have racked up high-profile losses.

Follow our updates.
https://t.co/iNCVs1majj"
"In an election that came down to which party turned off voters the least, it was another bad national showing for the GOP. https://t.co/Qk2kcxPpgg"
"The Hong Kong government demanded an investigation after ""Glory to Hong Kong,"" a song linked with the pro-democracy protests of 2019, was played instead of the Chinese national anthem before a rugby match by the city’s team at a tournament in South Korea. https://t.co/ULaILC1sSl"
"Iran launched ballistic missile and drone attacks across the border at Kurdish Iranian opposition bases in Iraq on Monday, killing at least two people and wounding at least nine, according to opposition groups.
https://t.co/qEFWbIVKQh"
"Japan is starting to rely more on its own military as threats multiply in the region. 

By asserting its own power, Japan could become less a military protectorate of the U.S. and more an equal partner. That shift could alter the balance of power in Asia. https://t.co/ezL7er0iDp"
President Volodymyr Zelensky of Ukraine said the authorities had discovered evidence of more than 400 potential war crimes in Kherson similar to what has been found in other areas reclaimed from Russian forces. https://t.co/ya6mMj6cNy
"Breaking News: A student gunman was at large after fatally shooting three people and wounding two others at the University of Virginia, the authorities said.
https://t.co/1EoIBkDdnq"
"President Biden and his Chinese counterpart, Xi Jinping, will hold a face-to-face meeting in Bali. The talks comes amid growing disputes over Taiwan, Ukraine and technology.

Here’s what to know.
https://t.co/3ZH8Ly0dvc"
"Sam Bankman-Fried, the chief executive of the collapsed cryptocurrency exchange FTX, was a proponent of the “effective altruism” philanthropy movement. Members of the community are asking themselves whether they might have helped burnish his reputation. https://t.co/d3QfNBnFFA"
"Breaking News: President Volodymyr Zelensky made an unannounced visit to Kherson, reveling in Ukraine’s success at recapturing the city from Russian forces. https://t.co/cp1CwdrsEC"
"President Joko Widodo of Indonesia, by background and inclination, is not a foreign policy leader. He has kept his focus close to home. But now he is seeking a bigger role on the world stage, albeit with a domestic agenda. His next big test: the G20 summit.https://t.co/U0gwBzwGQI"
Make these tangy and sweet two-toned lemon bars ahead of Thanksgiving — they’ll keep in the refrigerator for up to five days. https://t.co/aPMjyH3nnp https://t.co/H65rMUs1Qy
"As president, Donald Trump repeatedly said he wanted the IRS to investigate his political foes, a former chief of staff told The New York Times. https://t.co/m89N1z6NXj"
"Mehran Karimi Nasseri, an Iranian refugee who lived for 18 years in Charles de Gaulle Airport in Paris and whose story inspired the Steven Spielberg 2004 film “The Terminal,” died on Saturday in the same airport where he spent so much of his life. https://t.co/JnDseFAKxd https://t.co/XeEf2fN2qA"
RT @NYTScience: There's a new spacecraft orbiting the moon as of Sunday night -- NASA's CAPSTONE. Read more about its mission here: https:/…
"Carolina Sanín, a Colombian author and academic, published a post on feminism and transgender rights that she knew could generate heated debate. The repercussions were more far-reaching than anticipated — and have divided Latin American literary circles. https://t.co/1epcO9KfeG"
"A 10-year-old boy walked into the nurse's office of his school in Highland, New York, and asked for Vaseline. He wanted to rub it onto his new tattoo, which he got with his mother's permission. 

The nurse called the police. The boy's mother was arrested. https://t.co/DcmUdqFOKB"
"""Black Panther: Wakanda Forever,"" the sequel to the thunderous Marvel hit, finally reached theaters on Friday, leaving many fans teary-eyed and slack-jawed. See what people are saying and writing about it. https://t.co/L0MOLHtGTR"
"See what people are saying and writing about ""Black Panther: Wakanda Forever,"" the sequel that was this weekend's box office smash. https://t.co/vnri2TsbdE"
"Some Republicans on Sunday shows denied that Donald Trump is the leader of the Republican Party, following the party's unexpectedly weak midterms performance.

""We're not a cult,"" Senator Bill Cassidy of Louisiana said on NBC's ""Meet the Press."" https://t.co/rrQbtAX18R"
"In the southern part of Spain, churches and streets hold the remnants of eight centuries of Islamic rule. https://t.co/xB0W3nQqPB"
"In Opinion

“Georgia is a state transformed. Liberal Georgians have tasted power, and there is no turning back from it,” writes @CharlesMBlow. “Much of the credit belongs to Abrams.” https://t.co/DSxlGJem2w"
Opening up your favorite carry-on travel backpack should feel like opening the door to a well-organized closet. @Wirecutter spent six months testing 22 bags and flying across the country with all of their picks. https://t.co/6sB8QXe7IY
Russia’s pro-war activists delivered over the weekend their most cutting criticism to date of the military’s performance in Ukraine. The drumbeat of denunciations broke the taboo against singling out Vladimir Putin and Russia’s very system of government. https://t.co/9AAPLfsbwV
"From @TheAthletic

A busy Week 11 in college football saw the Pac-12 hurt its own case for the College Football Playoff and underdogs run wild, while unbeatens stayed perfect.
https://t.co/5TemhN6syD"
"President Biden feels buoyant after the better-than-expected midterms. But as he nears his 80th birthday, he confronts a decision on whether to run in 2024 that has some Democrats uncomfortable. https://t.co/VgfcazzkHc"
A stronger-than-expected midterms performance by Democrats that preserved their control of the Senate and left the House up for grabs has reshuffled the congressional agenda for the rest of the year. https://t.co/zI8k3DphhM
"""It just didn't work.""

Kherson was the focus of a Russian campaign to stamp out Ukrainian identity. National songs were banned, speaking Ukrainian could lead to arrest and students were told they were Russian. But then came the resistance. https://t.co/EdyzEgemF2"
"Six people were killed after two World War II-era airplanes collided in midair at an air show in Dallas on Saturday, officials said, turning the commemorative Veterans Day weekend event into a scene of horror. https://t.co/5lwEkPsXdA"
"In Opinion

“Silicon Valley, which since its founding was considered a bastion of progressivism and social liberalism, is moving to the right,” writes @namalhotra. https://t.co/42BXkCVN7Y"
"Lori Chavez-DeRemer, a Republican, flipped a U.S. House seat in central Oregon on Sunday, defeating Democrat Jamie McLeod-Skinner and handing her party a crucial victory in its push to win a majority. https://t.co/YbEDaMZBcQ"
"It's simplistic to label Paramount Network's ""Yellowstone"" as a ""red-state drama."" But the cowboy soap speaks the language of culture war with a perfect accent.

Read our critic's notebook on the show ahead of its new season starting Sunday night. https://t.co/upp9f281iB"
"By holding their Senate control, even with a bare-minimum majority, Democrats have preserved their ability to confirm President Biden's nominees and to stop Republican legislation in its tracks if the GOP wins the House. https://t.co/kiRh26t7ba"
"Carolina Sanín, a Colombian author and academic, published a post on feminism and transgender rights that she knew could generate heated debate. The repercussions were more far-reaching than anticipated — and have divided Latin American literary circles. https://t.co/lXjplCEpx4"
"The Vikings proved their mettle once again, Tom Brady finally has a full complement of receivers and is making use of them, and Justin Fields continues to be dangerous as a runner.

Here's what we learned from Week 10 in the NFL. https://t.co/fxrdAdlUdB"
"""When the national pundits said I couldn't win, I knew Nevada would prove them wrong,"" Senator Catherine Cortez Masto said in a victory speech the morning after her re-election clinched control of the Senate for Democrats. https://t.co/JSoz0FAn5r https://t.co/NkVH6mLgpY"
"A 10-year-old boy walked into the nurse's office of his school in Highland, New York, and asked for Vaseline. He wanted to rub it onto his new tattoo, which he got with his mother's permission. 

The nurse called the police. The boy's mother was arrested. https://t.co/SOKpURen30"
It's anxiety-inducing to share intimate details of your life with an audience of millions. But that's what three New York Times journalists did recently in our pages or on a Times podcast. Here's why they decided to open up. https://t.co/M4TUbnDu3c
"In Opinion

President Biden's first two years in office did not bring unity ""because the goal of national unity was unattainable in the first place — unattainable now, as it has always been in the nation's past,"" @JeremiSuri writes. https://t.co/bQauRU24vE"
"With the right routine, you can get the same (or even better) results from an intense 20-minute workout as you can from a one-hour session. Here's how. https://t.co/tqBESEt1Ee"
"“Black Panther: Wakanda Forever” took in $180 million at North American cinemas over the weekend, ending one of the worst box office droughts on record and reaffirming Disney-owned Marvel Studios as Hollywood’s reigning blockbuster factory. https://t.co/m7rq8KgkTb"
"Some Republicans on Sunday shows denied that Donald Trump is the leader of the Republican Party, following the party's unexpectedly weak midterms performance.

""We're not a cult,"" Senator Bill Cassidy of Louisiana said on NBC's ""Meet the Press."" https://t.co/3Lrfv01nUg"
"On ""Saturday Night Live,"" host Dave Chappelle commented on Kanye West's recent antisemitic remarks.

""I learned that there are two words in the English language that you should never say together in sequence,"" he said. ""And those are 'the' and 'Jews.'"" https://t.co/1mVLp9TP7x"
"Mistakes in screening procedures by TSA employees allowed a passenger to bring two box cutters aboard a Frontier Airlines flight from Cincinnati to Tampa, Florida, the agency said Sunday. The passenger later threatened to stab passengers and crew members. https://t.co/dA432s0qTq"
"The bombing in a bustling pedestrian thoroughfare in central Istanbul on Sunday, which killed at least six people, could be a terrorist attack, officials said. It was the deadliest attack in Turkey in more than five years. https://t.co/fYIDR86fYT"
"Nepal's effort to have communities protect and renew their local forests is decades in the making, and it's showing results — a rare success story in a world of cascading climate disasters and despair. https://t.co/NaQUPHUcBj"
"The British street artist Banksy unveiled his latest creation on Friday: a female gymnast depicted on a war-torn building in Borodyanka, Ukraine, one of the first places to be hit by Russian airstrikes after the invasion in February. https://t.co/96pXE6K2Lq"
"Video from Istanbul shows people fleeing after an explosion on Sunday that killed several people and wounded dozens of others near Taksim Square, one of the city’s busiest areas. https://t.co/wMuOZFOcqQ https://t.co/A2UnMlvtkD"
"In Opinion

""Today's mess is better understood as a global polycrisis,"" Thomas Homer-Dixon and Johan Rockström write, as ""humanity is dealing with a complex knot of seemingly distinct but actually deeply entangled crises."" https://t.co/PtIBSxtsxT"
"Mexico is the world's largest exporter of beer. But now, brewers and other heavy water users have landed at the center of a climate fight, as the government and industry confront water shortages in the country's north. https://t.co/ufDJxqAxHf"
"American private investigators are unknowingly being hired by a new kind of client: authoritarian governments like Iran and China attempting to surveil, harass, threaten and even repatriate dissidents living lawfully in the U.S. https://t.co/7EMLawV9dp"
"Representative Alexandria Ocasio-Cortez said in a CNN interview that she has feared for her life since becoming an elected official, and that the fear has influenced her political decision-making ""because I don't want to take the time I have for granted."" https://t.co/tWz8MU3fPo"
"Fluffier than both cheesecake and pumpkin pie, this dessert combines a silky cream cheese-pumpkin filling and a tangy sour cream topping. https://t.co/EVRbQoiLBR https://t.co/bTGzTX0sNP"
"Hurricane Fiona left Puerto Rico with significant flooding and a widespread power blackout. More than a month later, the impact remains most evident in remote communities that have suffered disproportionately from natural disasters and government neglect. https://t.co/Qnb21TT1St"
"If real Christmas trees don't work for your household, here are the artificial trees recommended by @Wirecutter experts. https://t.co/XGHiBuWoFG"
"The West African nation of Benin has adopted one of the continent’s most liberal laws on abortion, after hearing testimony from gynecologists about women dying from illegal procedures. https://t.co/exFtWU2drK"
"The explosion in Istanbul on Sunday, which killed at least six people and wounded dozens, shattered a five-year period of relative calm for Turkey, which had appeared to be moving away from the deadly attacks that had struck its cities in previous years. https://t.co/g2jl7lMxEI"
"A 10-year-old boy walked into the nurse's office of his school in Highland, New York, and asked for Vaseline. He wanted to rub it onto his new tattoo, which he got with his mother's permission. 

The nurse called the police. The boy's mother was arrested. https://t.co/SiwZGrUpGK"
"The front page of The New York Times for Nov. 13, 2022. https://t.co/z4JNaVz5RS https://t.co/cuc0ftSaMf"
"Did John Fetterman show Democrats how to solve their white-working-class problem? His victory in Pennsylvania's Senate race was achieved in part by attracting voters in the reddest parts of the state, even outpacing the support for President Biden in 2020. https://t.co/sYWtWLzXvn"
"Many of the millions of tourists who visit Turkey each year spend time in the area where Sunday’s bombing took place: Istanbul's iconic Istiklal Avenue, a pedestrian thoroughfare traversed by a tram and lined with vendors and historic buildings. https://t.co/mNSDtxAHC4"
"The value of farmland is soaring across the U.S., hitting record highs this year and often pricing out small or beginning farmers who are going up against private equity firms and real estate developers. https://t.co/2MfjRCuuAH"
"Elon Musk ordenó recortes inmediatos en Twitter, despidió a ejecutivos por correo electrónico, impuso plazos de entrega de productos y más cambios. Las consecuencias a menudo han sido atroces, dijeron 36 empleados, exempleados y gente cercana a la empresa. https://t.co/Y83Ow22rLb"
"The individual showings of Senate candidates across the U.S. varied widely in the midterms. Some Democrats and Republicans improved on the 2020 margins of President Biden and Donald Trump, while others did worse but still won. See our analysis. https://t.co/3oHI39rf0M"
"RT @TheAthletic: The Pac-12's biggest enemy continues to be... the Pac-12.

CFP hopes for the conference may have been dashed Saturday as i…"
"Kim Jong-un has launched a record number of missiles this year, hoping to leverage U.S.-China tensions and exploit hostilities toward Moscow. He has said a ""neo-Cold War"" is emerging, and seems to see the geopolitical tide turning in North Korea's favor. https://t.co/lLI45HAaky"
"""Heat pumps are good for your wallet — and the world.

Wirecutter breaks down why they’re the cheapest and most efficient way to handle both heating and cooling for your home, no matter where you live. https://t.co/42e4rAa5v7"""
"President Biden trod a well-worn presidential path by going abroad on official functions just after the midterms. But during his trip, the news from home has kept getting better for Democrats. https://t.co/id6vv5xfUd"
"President Recep Tayyip Erdogan of Turkey attributed a blast in central Istanbul on Sunday, which killed at least six people and wounded at least 53, to a “bomb attack” and said those who carried it out would be punished. https://t.co/AzJSeKMY4J"
"In Opinion

“One of the most troubling facts about adherents of extremist movements is that veterans, active-duty military personnel and members of law enforcement are overrepresented,” writes the Times editorial board. https://t.co/cGNIMq3RDF"
"A fresh face arrives on the shores of Wakanda in ""Black Panther: Wakanda Forever."" His name is Namor, and he's played by Tenoch Huerta Mejía. The character is new to the Marvel Cinematic Universe, but he has roots in the earliest days of Marvel Comics. https://t.co/onlJjAx4lj"
"Democrats turned in the best midterm showing in two decades for a party holding the White House. Interviews with more than 70 people reveal the miscalculations, misreadings and infighting in both parties that led the GOP to blow its chance at a blowout. https://t.co/WVgWOcLBfW"
"Six people were killed after two World War II-era airplanes collided in midair at an air show in Dallas on Saturday, officials said, turning the commemorative Veterans Day weekend event into a scene of horror. https://t.co/Kl5KH9M7ef"
"Breaking News: An explosion shook a bustling pedestrian thoroughfare in central Istanbul on Sunday, killing at least four people and leaving 38 wounded, the provincial governor said. https://t.co/qY6c3ysCp9"
"In this take on a Thanksgiving classic, standard pie dough is swapped for pecan sandie dough. It’s not only tastier with its nuttiness, it also doesn’t require rolling.  https://t.co/GBYVGyYib3 https://t.co/fM8z4m8e9N"
"Electric vehicles are starting to go mainstream in the U.S. after making earlier inroads into the mass markets in China and Europe. Sales are still skewed toward affluent buyers, but now, more people are choosing them to save money. https://t.co/kpKZPxYSIa"
"Democrats kept control of the Senate, but House control is still up for grabs, with 20 races still not called. Track the remaining races here. https://t.co/Az5QOAhT8P"
"If you wake up with pain in your head, neck, and shoulders, you might benefit from swapping out your pillow for a firmer, memory-foam option. Here are a few 
@wirecutter recommendations after testing more than a dozen. https://t.co/0xnYwkNGni"
"Before the midterm votes are even fully counted, Republicans face a decision: Do they stick with Donald Trump into 2024 or leave him? There are signs of an effort to inch the GOP away from Trump ahead of his scheduled announcement Tuesday of another run. https://t.co/i9SR8xuCBK"
🟨🟩 How did you do in Wordle today? 🟨🟩  https://t.co/S4QpETRtVc https://t.co/bAQoABAunj
"Three former Pennsylvania police officers each pleaded guilty to 10 counts of reckless endangerment in the fatal shooting of Fanta Bility, an 8-year-old girl, outside a high school football game last year. https://t.co/S3WEI84Ka1"
"RT @katierogers: NEW: ""We’ve seen the affirmation of the president’s agenda, vindication of his message, and rejection of so many election…"
"On ""Saturday Night Live,"" host Dave Chappelle commented on Kanye West's recent antisemitic remarks.

""I learned that there are two words in the English language that you should never say together in sequence,"" he said. ""And those are 'the' and 'Jews.'"" https://t.co/2Ps93kx8zA"
"Chris Magnus, commissioner of Customs and Border Protection, submitted his resignation on Saturday after a daylong standoff with his boss, the Homeland Security secretary, who just days earlier had demanded that he either step down or be fired. https://t.co/cWT6i7JWEj"
How have you rebuilt after a disaster? We want to hear your stories. https://t.co/4ayJk7apbi
"With the holidays approaching, have you thought about how you’ll accommodate all of your guests when they come for dinner?

If you’re expecting a big crowd, a small table with four chairs won’t cut it.

https://t.co/29qGACKkad"
Many people believe that cooking vegetables zaps their nutrition. But some experts say that the heat from cooking can actually enhance some nutrients. Curious which vegetables are healthier raw versus cooked? Take this quiz to find out. https://t.co/ul039gDiMs
"With the right routine, you can get the same (or even better) results from an intense 20-minute workout as you can from a one-hour session. Here's how. https://t.co/rhNrINg6hB"
"If you take an antidepressant or are considering one, here’s what to know about how they work and how their effectiveness is measured. https://t.co/NSn3kdCdNZ"
"""I started thinking, what's the one story I haven't told that I'd be really mad at myself if I don't?""

Steven Spielberg discusses what it took to make his new autobiographical film, ""The Fabelmans."" https://t.co/r1DSqcPQqL"
"Barcelona’s “superblock” initiative has made parts of the city into car-free, pedestrian playgrounds. Bike lanes crisscross the Catalan capital, and the Sant Antoni market is again bustling with fishmongers and butchers. 

Here’s our 36 Hours guide. https://t.co/jbG7f4IN56"
More than half of U.S. adults in a 2021 study reported symptoms of major depressive disorder after a coronavirus infection. The risk of developing these symptoms — as well as other mental health disorders — remains high up to a year after you’ve recovered. https://t.co/ZsTGVUVa6j
"The British street artist Banksy unveiled his latest creation on Friday: a female gymnast depicted on a war-torn building in Borodyanka, Ukraine, one of the first places to be hit by Russian airstrikes after the invasion in February. https://t.co/zwt4xBx8gT"
"Female college athletes are making millions thanks to large social media followings. But an old concern has resurfaced: Sex sells, and some who fought for equity worry their brand building is regressive.

Read this and 10 other stories in The Weekender. https://t.co/5wGg3zKuCj"
"Though people mainly associate panic attacks with the mind, they’re actually constellations of symptoms, both physical and cognitive. Here's a look at what happens in the body during one and ways you can cope. https://t.co/r81UCgV4sn"
Israel Adesanya is set to defend his 185-pound crown against Alex Pereira at UFC 281. Follow live updates. https://t.co/U7nAnbFhUF
The effects of global warming on Egypt's treasured monuments are already striking. And the changing weather is only amplifying centuries of destructive human impact. https://t.co/w20mIlDfvC
