"A dam some 50 miles to the northeast of Kherson was damaged on Friday. The road over it was the last major crossing left to Russian forces, and the vital piece of infrastructure holds back a body of water the size of the Great Salt Lake in Utah. https://t.co/OQlogeF9Uj"
The Senate race in Nevada could be crucial to deciding control of Congress. Find the latest results here. https://t.co/evjkvkHyjL
"Senator Catherine Cortez Masto of Nevada, a Democrat, has been winning mail ballots by a wide margin in Clark County, the state’s most populous and home to Las Vegas. She's now in striking distance of her Republican challenger, Adam Laxalt. https://t.co/omob3ZCG8R"
"Election results take time, especially in places where many people vote by mail. Here's a look at how long it took to declare a winner from each state in 2020 — and how long state officials expected it to take this year, according to a pre-election survey. https://t.co/NX8GCF8tCw"
"Kevin Conroy, the voice of Batman for three decades across almost three dozen TV shows, movies and video games, died on Thursday. He was 66. Without ever showing his face, he spent more time playing Batman than any actor did on screen. https://t.co/QvcuN0AZEs"
"As states continue to count the outstanding votes from the midterm elections, we’re tracking results in the remaining uncalled House races.https://t.co/Mi1RxskXIq"
"Elon Musk ordered immediate layoffs at Twitter, fired executives by email, laid down product deadlines and has transformed the company. 

The fallout has often been excruciating, said 36 current and former Twitter employees and people close to the company. https://t.co/cYVxcxs0xw"
"""I cannot believe how perfect these cookies are.""

The secret ingredient in these distinctive cookies? Ovaltine. 
https://t.co/hkjO4P7cDs"
"“Glory to Ukraine!” people on the sidewalks in Kherson shouted as Ukrainian soldiers swept into the city on Friday, just weeks after President Vladimir Putin declared the Kherson region a part of Russia forever. https://t.co/IfkWasbgc4"
"Representative Liz Cheney called the losses by far-right candidates in the midterm elections this week a “clear victory for team normal.” 
https://t.co/ImNLriDleK"
"“Right around the middle of the courses, the water starts to disappear. People are like, ‘Oh, yeah, I’m smoking weed.’” https://t.co/yeYQ9hqNqj"
Find live results from Arizona's crucial U.S. Senate race as they're reported here. https://t.co/yOvLZZCk5k
"Officials with Arizona’s largest county, Maricopa, say they will release the results of some 80,000 more ballots at 8 p.m. local time, potentially providing some clarity in crucial races. More than 300,000 ballots remain uncounted, they added. https://t.co/4o02uTC4OT"
"Venture capital firms and investment funds showered nearly $2 billion on Sam Bankman-Fried and his crypto exchange, FTX. After the company's sudden collapse, investors are now under scrutiny, too, for enabling Bankman-Fried with so little oversight. https://t.co/YqDINEJXhy"
"It's been days since the midterm elections, but there is still plenty of vote counting to go in Nevada — and its Senate race is key in deciding who will control Congress. Here's why it's taking so long to get a full tally. https://t.co/DWWE8L8KFu"
"A day after Hurricane Nicole battered Florida, the storm merged with another weather system on Friday as it moved north as a tropical depression and then a post-tropical cyclone, soaking parts of several states with inches of rain, forecasters said. https://t.co/NVG98R5KBC"
"A 120-year-old piece by Gustav Mahler is finding new listeners after a star turn in the new Cate Blanchett drama, “Tár,” 
https://t.co/jWHyBIPWGg"
"Alec Baldwin filed a lawsuit on Friday against several people associated with the film “Rust” — including its armorer and first assistant director — accusing them of negligence for giving him a loaded gun on the set that fired, killing the cinematographer. https://t.co/sInzELWYz7"
"The Republican Party, facing the worst midterm performance by a party out of power in two decades, is wrestling with whether the ultimate cause was poor candidates, an overheated message or Donald Trump, the anchor who appears to be dragging the GOP down. https://t.co/rQpRWqRab9"
"One of the largest food safety companies in the U.S., Packers Sanitation Services, illegally employed more than two dozen children, the Labor Department found. Some were as young as 13, and several suffered chemical burns from corrosive cleaners. https://t.co/sSxH7sWcFa"
"In Opinion

“Congress now should do its part and act, in its final weeks in session, to clarify and strengthen the federal law governing counting and certifying electoral votes in presidential elections,” the New York Times editorial board writes.
https://t.co/sGpbYBuwS2"
"Twitter descended into a swirl of parody accounts after Elon Musk moved to offer verification for $8 a month. One fake Tesla account bragged about using child labor. By Thursday, it seemed to become too much for Musk, and ""official"" labels were rushed out. https://t.co/x6OSMOR89x"
"When hosting Thanksgiving for the first time, it’s best to keep it simple. These basics recommended by @wirecutter are all you really need, and they’ll serve you well year-round. https://t.co/CD68Gee6k2"
"Representative Lauren Boebert of Colorado, a far-right provocateur in the House, was leading her Democratic challenger, Adam Frisch, by less than 1,200 votes as of Friday. A recount is possible, and it could take weeks to settle the race. https://t.co/tJfiRvLiqq"
A woman wept with joy as she embraced a Ukrainian soldier after Russia formally announced its retreat from villages along the Kherson front in southern Ukraine. The move puts Kyiv on the cusp of achieving one of its most significant victories of the war. https://t.co/gxuicj9GMU https://t.co/brHIbIHuyc
"Unable to compete against older buyers with cash offers, many younger Americans feel locked out of homeownership.

“It feels like it’s never our time,” one 28-year-old said. “I’m stuck at the starting line and other people have been able to progress.”
https://t.co/rERDLRdKzG"
"""Black Panther: Wakanda Forever,"" the sequel to the thunderous Marvel hit, finally reached theaters on Friday, leaving many fans teary-eyed and slack-jawed. See what people are saying and writing about it. https://t.co/KI963KMawZ"
This dessert delivers all the warm spices of pumpkin pie along with the tangy creaminess of cheesecake. https://t.co/fqTwm5Xs2h https://t.co/cCgnnjaSjM
"The collapse of the cryptocurrency exchange FTX ""is essentially going to kill what is left of the crypto venture capital market,"" The New York Times tech columnist @kevinroose says on the ""Hard Fork"" podcast. Listen now. https://t.co/AWiSZ7kWfd https://t.co/AWiSZ7kWfd https://t.co/RMEizteaFe"
"After a fire at the National Museum of Brazil destroyed thousands of artifacts representing the cultural history of the country’s Indigenous populations, curators are adopting a radical new approach.
https://t.co/5CtaeLYCYj"
"Mimi Parker, who founded the band Low with her husband Alan Sparhawk, has died at 55. Parker's haunting vocals and spare drumming helped define the moody, minimalist sound of a trio that emerged in the 1990s alt-rock world and endured for nearly 30 years. https://t.co/t7BUcnWodt"
"Gift baskets are usually terrible. After considering nearly 120 gift-basket suggestions, @Wirecutter found 17 outstanding options through extensive research, personal experiences and taste tests. https://t.co/U8WcYE4Zwo"
"Para entender mejor el viaje que tantos emprenden, @julieturkewitz, la jefa del buró de los Andes de The New York Times, y el fotógrafo @federicorios recorrieron 112 kilómetros en el Tapón del Darién. 

Así reportaron esta nota. 

https://t.co/AS3vOT9saA"
"Durante años, el Tapón del Darién  —un puente terrestre sin carreteras, hostil y poco poblado que conecta Centro y Sudamérica— se consideraba tan peligroso que solo unos pocos se atrevían a cruzarlo.

Este año, 215.000 personas lo han hecho.
https://t.co/AS3vOT9saA https://t.co/SaY3aryQVL"
"Un día, Sarah y su mamá se disponían a escalar una loma lodosa. La madre, con los pies llenos de ampollas, pidió a un amigo que llevara a su hija. Él cargó a Sarah, mirando a menudo atrás. 

En algún momento, volteó y la mujer ya no estaba.  
https://t.co/AS3vOT8Ul2 https://t.co/DJlvhIsfAB"
"Vendieron sus cosas y avanzaron en bus, en barco y a pie. Por el camino, hallaron gente que cobraba por transporte, comida, refugios rudimentarios.

Una noche acamparon en un pueblo con un campamento rodeado de alambre. Para salir, cada persona debía pagar 20 USD. https://t.co/7oooiJzyxh"
"Sus compañeros migrantes le dieron un nuevo nombre: la niña extraviada.

Sarah Cuauro, de 6 años, había comenzado el viaje desde Venezuela con su madre. Iban para EE. UU., pero antes debían cruzar un tramo brutal de selva llamado el Darién. https://t.co/m3AekwmCcc https://t.co/TX8hGpbD29"
"In Opinion

""My husband is dead, executed in July by Myanmar’s military junta, which overthrew a democratically elected civilian government and seized power,"" Nilar Thein, a Myanmar democracy activist, writes in a guest essay. ""I am now on the run.""
https://t.co/nz9rCxmeUw"
"Arizona’s major races crept toward a dramatic conclusion Friday. Senator Mark Kelly, a Democrat, holds an edge in his bid for re-election. But the race for governor appears to be a true tossup, and Republican candidates are sowing doubt about the results. https://t.co/ratrVBGikr"
"Suiza, uno de los países más ricos, tiene un objetivo climático ambicioso: reducir sus emisiones de efecto invernadero a la mitad para 2030. Pero en lugar de recortarlas mucho en su territorio, el país paga para que los países pobres reduzcan las suyas. https://t.co/XTTPbDtccl"
"The landscape before the midterms looked bleak for incumbents, especially Democrats, and many braced to feel voters’ outrage. But early tallies show that voters mostly opted to keep their members of Congress. https://t.co/Lutn8swRdo"
"RT @Nate_Cohn: The main thing that stands out to me about this election: idiosyncratic results by state. 
In some states, Democrats excelle…"
"The U.S. is placing India at the center of its ambition to detach global supply chains from American adversaries, seeking to cement ties with one of the world’s fastest-growing economies as tension with China and Russia builds.
https://t.co/UUExO5RzSe"
"No one likes a downgrade, least of all when traveling. But trying to maintain the elite status privileges granted to some at the height of the pandemic is going to get harder in the next few months, as loyalty programs undergo a “great reset.” https://t.co/mZjSELeQNd"
"President Biden announced U.S. support for a multibillion initiative that would increase Egyptian gas exports —  but as part of a program to cut one-fifth of Egypt’s power emissions.
https://t.co/QiS57oCfv0"
"This feels like an old-fashioned apple pie, made all the lovelier with a bold, modern top that blankets juicy blackberries and sweet-tart apples. https://t.co/ImeHm5W9y7 https://t.co/OYqbjQxcd0"
"Breaking News: The head of Customs and Border Protection is refusing to resign despite a request from the homeland security secretary.
https://t.co/LvuLqCovxX"
"RT @ewong: NEW: Biden &amp; Xi meet soon in Bali. Here's everything you need to know about their tense relationship. They'll talk on Taiwan, Ru…"
"From @TheAthleticFC:

Scoring the winning goal in a World Cup final is the dream for any soccer player.
But Mario Gotze, who netted the immortal goal for Germany in 2014, would have preferred to have done it differently.
https://t.co/9VUk6SzUcz"
"With Britain experiencing its largest ever outbreak of avian flu, the government ordered this week that all poultry and captive birds must be housed in an effort to limit the spread of the disease.

That includes the ravens at the Tower of London.
https://t.co/FE10c9Wmrl"
"""With inimitable swagger and respect for its audience’s intelligence, it undoes expectations, turning again and again into gloriously absurdist territory,"" Niela Orr writes in @NYTmag, as Donald Glover’s ""Atlanta"" ends its fourth and final season. https://t.co/Fr7SpNKIUB"
A thoughtful and useful gift needn’t be expensive. @Wirecutter has found dozens of surprisingly awesome items that cost less than $25. https://t.co/NGXkIbrQRL
The Wordle answers last week — Oct. 31 to Nov. 6 — were easier than those from the week before. See a full review of last week’s answers in the Wordle Wrap-Up: https://t.co/9Q4AYdBSaI https://t.co/7wxKVyyoJW
"Tiene 6 años y ya conoce el temor de cruzar una selva lodosa de Sudamérica a Norteamérica. Ahí es donde su madre se perdió.
https://t.co/PeM00JiTjW"
Miso and sesame add nutty warmth to a buttery dish of glazed carrots that’s delicious warm or at room temperature. https://t.co/gXxspjNS7U https://t.co/uUkaTETAvK
Several of the most competitive state-level races with consequences for abortion are still too close to call. See more of our story on how the midterm elections are affecting the abortion landscape. https://t.co/z5xfBeTYn6
"In Florida, Republicans won supermajorities in both chambers of the legislature, setting the stage for further restrictions. In Ohio, Republicans won all three seats up for grabs on the state Supreme Court, securing a stronger conservative majority. https://t.co/WWdMseihvL https://t.co/kGAeZOgQVl"
"In some states that already limit abortion access, races up and down the ballot removed Democratic lawmakers who stood in the way of restrictions. With fewer obstacles, Republican majorities are expected to pass new or more restrictive bans. https://t.co/z5xfBeBP8Y https://t.co/APOwuG8Spx"
"Voters in several states showed broad support for abortion rights, with California, Michigan and Vermont enshrining lasting protections in their state Constitutions and those in Kentucky and Montana rejecting anti-abortion measures. https://t.co/z5xfBeTYn6 https://t.co/nHCNHEtFcE"
"Gallagher, a comedian known for his outrageous act that always concluded with the smashing of a watermelon, died at 76.
https://t.co/UUHq1CRT6p"
"Max Martin, a Swedish songwriter and producer, has had 25 No. 1 hits on the Billboard Hot 100 and is behind smashes from Britney Spears, Katy Perry and the Weeknd.

He is now reluctantly emerging for “&amp; Juliet,” a new Broadway show built on his many hits.
https://t.co/lDpenyl8Lq"
The first election after Roe v. Wade was overturned proved to be a test of support for abortion rights. But the midterms appear unlikely to meaningfully reshape the map of abortion access — at least not right away. https://t.co/FYP5Oq0Bui
"The Belgian authorities said on Friday that the suspect in a knife attack that killed a police officer was on the government’s watch list of potential extremists, and that they were treating the assault as a possible terrorist attack.
https://t.co/I6U240nXQs"
"🟨🟩 How did you do in Wordle today? 🟨🟩  

It took the average player 4.1 guesses. https://t.co/bTdRw4sxf8 https://t.co/vy0jlOFFFY"
RT @dgelles: NEW: A diverse range of American activists excoriated the Biden administration for failing to act decisively on climate change…
"RT @CaseyNewton: It’s Hard Fork Friday! This week, Kevin and I once again cancel our Thursday evening plans to talk about a truly historic…"
"If real Christmas trees don't work for your household, here are the artificial trees recommended by @Wirecutter experts. https://t.co/PqUyrnhjWi https://t.co/LPWPyfjoXy"
"RT @TheAthleticFC: Sadio Mane has been selected in Senegal’s 26-man squad for the #WorldCup

The 30-year-old was forced off injured just 20…"
"RT @kevinroose: New Hard Fork! This week: unpacking the Twitter chaos, the FTX collapse, and what’s going on with big layoffs in tech. http…"
"In the villages west of Kherson, there were signs of a hasty Russian retreat and faltering efforts to slow the Ukrainian advance.
https://t.co/K64WCGb24L"
"""In 'Black Panther: Wakanda Forever,' the director Ryan Coogler feeds his own and the public’s grief into the story, infusing the movie with somber notes of family loss and collective mourning,"" our critic @aoscott writes.
https://t.co/erkKJYTMKr"
"Germany has embarked on an ambitious, expensive and uncertain effort to save the Rhine’s historical role as a vital transport link for the country's economy from the adverse effects of climate change.
https://t.co/1lG6Id0ify"
"RT @joecoscarelli: spent some time w MAX MARTIN, the most successful songwriter of my lifetime, who's taking his 25 No. 1 hits (!) to Broad…"
"Civilians in Kherson waved flags and chanted as they welcomed Ukrainian troops who entered the city after a major Russian retreat.

The arrival of the troops puts Ukraine on the cusp of achieving one of its most significant victories of the war.
https://t.co/y4cLSMjhfn https://t.co/g74s1nvvs8"
"“A climate crisis is about human security, economic security, environmental security, national security, and the very life of the planet,” President Biden said at the #COP27 climate summit in Egypt. 

Follow live.
https://t.co/TI12s6HxjT"
"The costume designer of ""The Crown"" knew a key moment of Season 5 would be when Princess Diana steps out in what became known as her ""revenge dress."" 

When Elizabeth Debicki, who plays Diana, emerged in the dress, the ""atmosphere was electric,"" she said. https://t.co/FCQcUfcCkc"
RT @kateconger: We spoke with 30+ people about Elon Musk’s first 2 weeks at Twitter. Story with @MikeIsaac @RMac18 @tiffkhsu https://t.co/u…
"Princess Martha Louise of Norway, who has long claimed to be clairvoyant, has quit her royal duties over public criticism of her fiancé, an American celebrity shaman who sells a $222 healing amulet and has suggested cancer is a choice. https://t.co/RAyo8fm9iJ"
"Breaking News: Ukraine’s troops entered the key city of Kherson, its military said, as jubilant residents waved Ukrainian flags after a major Russian retreat.
https://t.co/TqIlp2SNZt"
"Breaking News: The embattled cryptocurrency exchange FTX said it was filing for bankruptcy, capping a week that has upended crypto markets.
https://t.co/ZSprRcIpgg"
"Election officials were braced for partisan poll monitors convinced of fraud to disrupt voting in the midterm elections. While there were scattered episodes, the vote went smoothly. https://t.co/6Sh0JD11Wg"
"Armistice Day, which originally marked the end of World War I, was broadened in the 1950s to honor veterans of all wars.
https://t.co/NTdz1iHvmY"
"If you are a fan of lemon curd or the classic French tarte au citron, you will love this cranberry version. The finished tart keeps well for a couple of days. https://t.co/3mARuIpHav https://t.co/9CHZx2P1Kg"
"Elon Musk ordered immediate layoffs at Twitter, fired executives by email, laid down product deadlines and has transformed the company. 

The fallout has often been excruciating, said 36 current and former Twitter employees and people close to the company. https://t.co/M7PTvwmDsr"
"RT @bradplumer: Global CO2 emissions from fossil fuels are poised to increase 1% this year, hitting new record highs. 

Some interesting tw…"
"The blending of fact and fiction in Season 5 of ""The Crown"" has received more criticism than ever. Here’s a look at how the dramatic plotlines of a monarchy in flux were reported when they actually happened. https://t.co/aRCnKGg422"
"A shallow, strong earthquake with a magnitude of 7.3 struck in the sea about 130 miles off the coast of Tonga, setting off tsunami warnings across the Pacific Island region. https://t.co/603XKqALNk"
"A day after Hurricane Nicole made landfall in Florida, the storm, now a tropical depression, will merge with another weather system as it moves north, soaking parts of the Southeast and Mid-Atlantic States with several inches of rain, forecasters said. https://t.co/GWjSx6dFaV"
"A judge temporarily barred the state of New York from issuing the first batch of retail licenses for recreational cannabis in five regions, pending resolution of a lawsuit challenging the program’s selection requirements. https://t.co/bxk81IBMQF"
"President Biden arrives in Egypt to speak at #COP27 as developing countries are excoriating the U.S. and other major polluters for causing climate change.

Follow updates. https://t.co/2E3iaqrHTf"
"The Chinese government adjusted some of its Covid restrictions, even as it remained committed to its strict ""zero-Covid"" pandemic policy. https://t.co/b39vZWCIsw"
"Voting may be over, but the election still isn’t. 

Democrats are optimistic about holding the Senate as vote counting continues in Arizona and Nevada, and Georgia prepares for a runoff. On the House side, the picture looks better for Republicans. https://t.co/dzPKvQEt9I"
"RT @Karan_Singhs: Something magical is happening in Nepal: Its “trees are coming back.”
 
Whoa, what? I promise to explain (and hopefully e…"
"Ukrainian troops were advancing in the south on Thursday after Russia’s announcement of a retreat from Kherson. 

Here are maps of where Russia said it was retreating. https://t.co/7sGyxaCCPk"
Here's a look at some of the highlights worth watching from late-night TV. https://t.co/87Qj4MhjEO
"As explosions rocked Kherson, the Kremlin said Russia's withdrawal from the key city was complete, though residents said some soldiers remained. https://t.co/AoKamapAtf"
"For years, China’s annual shopping extravaganza known as Singles Day looked like a profitable exchange between East and West. But as Xi Jinping pushes China to become more economically self-sufficient, homegrown brands are increasingly the preferred choice.https://t.co/6IDvMwF9aP"
"KFC Germany apologized for seeming to encourage its customers to mark the anniversary of Kristallnacht — the notorious Nazi pogrom against Jews — by eating ""tender cheese with crispy chicken,"" saying that an automated push notification was sent in error. https://t.co/k6eDcng8nc"
"News Analysis: With each new setback in Ukraine, it is getting harder for President Vladimir Putin of Russia to separate himself from the whiff of failure, which is gradually eroding his image as a decisive, indomitable leader, Neil MacFarquhar writes. https://t.co/NXsBDen9vn"
"A day after Russia said it was withdrawing from Kherson City, the Ukrainian Army moved cautiously into heavily mined villages abandoned by Russian troops without a fight.

Ukrainian civilians greeted the soldiers. Some cheered. Some wept in relief. https://t.co/dxoHEJHNda"
"Talking about issues in our daily lives caused by climate change ""raises awareness and understanding that this is not an issue that we can delay on any longer,"" @leahstokes says. Listen to the talk with @skarlamangla, @GreggRSparkman and @hal_harvey. https://t.co/xebQdpBHA8"
"Breaking News: The British economy shrank over July, August and September, a sign that a predicted recession may be beginning. https://t.co/3bP4rYqSik"
"In New York, where registered Democrats vastly outnumber Republicans, voters showed some support for some Trump-aligned candidates. Republicans flipped four House seats held by Democrats, and some incoming congressmen have embraced hard-right positions. https://t.co/ZxJnMBZ9hG"
"The theory of the ""wood-wide web"" — a wispy underground network that sends nutrients and information between trees — has captured the public imagination. Some scientists say it is overblown and unproven. https://t.co/vA0nNb2Wla https://t.co/6OUb6UbaD8"
"More than 50,000 ballots remain to be counted in Clark County, Nevada, the county’s registrar of voters said. The votes could play a key role in determining who controls the Senate. The elections staff plans to work through the weekend to try to count them.https://t.co/lvJoQ4bmKa"
"The Georgia runoff election between Raphael Warnock, a Democrat, and Herschel Walker, the Republican former football star, may determine control of the Senate, though that was still unclear on Thursday as votes continued to be counted in Arizona and Nevada.https://t.co/X9WXu2thgA"
RT @adamgoldmanNYT: The judge in a scathing 19-page ruling accused Mr. Trump’s lawyers of abusing the legal system by suing for political p…
"Global fossil fuel emissions will most likely reach record highs in 2022 and do not yet show signs of declining, researchers said Thursday, a trend that puts countries further away from their goal of stopping global warming.
https://t.co/COxoGFBppg"
"Some retailers are already offering deals that are just as good as day-of Black Friday discounts — in fact, some of these @Wirecutter picks have never been lower, making this a great opportunity for shoppers. https://t.co/WHXJw9nWaY"
"Tina Kotek, a Democrat who faced a pair of well-funded challengers, won the Oregon governor’s race. 

Kotek’s victory will make her and Maura Healey, who won the Massachusetts governor’s race, the first openly lesbian governors in American history. https://t.co/adXtnYf4Zv https://t.co/oJbrgveXC3"
"RT @StacyCowley: “In this country, we are not ruled by an all-powerful executive with a pen and a phone,” the Texas judge wrote.

(The ruli…"
"A federal judge in Texas rejected President Biden’s executive action to cancel hundreds of billions of dollars in student debt, further clouding the situation for borrowers who have applied to a program already on hold because of legal obstacles. https://t.co/mx6kq4xZc3"
"Humans have been battling rats for eons, and during the pandemic, the rats seemed to be winning.
https://t.co/9wt90Xnv9U"
"RT @kateconger: Musk said Twitter remains overstaffed after 50 percent layoffs, said he had recently sold Tesla stock in a bid to ""save"" Tw…"
